artist,song title ,text
Indigo Girls,closer to fine,im trying to tell you something about my life maybe give me insight between black and white and the best thing youve ever done for me is to help me take my life less seriously its only life after all well darkness has a hunger thats insatiable and lightness has a call thats hard to hear and i wrap my fear around me like a blanket i sailed my ship of safety til i sank it im crawling on your shores and i went to the doctor i went to the mountains i looked to the children i drank from the fountains theres more than one answer to these questions pointing me in a crooked line and the less i seek my source for some definitive closer i am to fine closer i am to fine and i went to see the doctor of philosophy with a poster of rasputin and a beard down to his knee he never did marry or see a b grade movie he graded my performance he said he could see through me i spent four years prostrate to the higher mind got my paper and i was free i went to the doctor i went to the mountains i looked to the children i drank from the fountains theres more than one answer to these questions pointing me in crooked line and the less i seek my source for some definitive closer i am to fine closer i am to fine i stopped by the bar at 3 a m to seek solace in a bottle or possibly a friend and i woke up with a headache like my head against a board twice as cloudy as id been the night before and i went in seeking clarity i went to the doctor i went to the mountains i looked to the children i drank from the fountain we go to the doctor we go to the mountains we look to the children we drink from the fountain we go to the bible we go through the workout we read up on revival we stand up for the lookout theres more than one answer to these questions pointing me in a crooked line and the less i seek my source for some definitive closer i am to fine closer i am to fine closer i am to fine
Indigo Girls,secure yourself,in the ink of an eye i saw you bleed through the thunder i could hear you scream solid to the air i breath open eyed and fast asleep falling softly as the rain no footsteps ringing in your ears ragged down worn to the skin warrior raging have no fear secure yourself to heaven hold on tight the night has come fasten up your earthly burdens you have just begun kneeling down with broken prayers hearts and bones from days of youth restless with an angels wing i dig a grave to bury you no feet to fall you need no ground allowed to glide right through the sun released from circles guarded tight now we all are chosen ones secure yourself to heaven hold on tight the night has come fasten up your earthly burdens you have just begun
Indigo Girls,kid fears,pain from pearls hey little girl how much have you grown pain from pearls hey little girl flower for the ones youve known are you on fire from the years what would you give for your kid fears secret staircase running high you had a hiding place secret staircase running low but they all know now youre inside are you on fire from the years what would you give for yourkid fears skipping stones we know the price now any sin will do how much further if you can spin how much further if you are smooth are you on fire from the years what would you give for yourkid fears replace the rent with the stars above replace the need with love replace the anger with the tide replace the ones the ones the ones that you love replace the rent with the stars above replace the need with love replace the anger with the tide replace the ones the ones the ones that you love are you on fire from the years what would you give for yourkid fears replace the rent with the stars above replace the need with love replace the anger with the tide replace the ones the ones the ones that you love
Indigo Girls,prince of darkness,my place is of the sun and this place is of the dark i do not feel the romance i do not catch the spark i dont know when i noticed life was life at my expense the words of my heart lined up like prisoners on a fence the dreams came in like needy children tugging at my sleeve i said i have no way of feeding you so leave but there was a time i asked my father for a dollar and he gave it a ten dollar raise when i needed my mother and i called her she stayed with me for days and now someones on the telephone desperate in his pain someones on the bathroom floor doing her cocaine someones got his finger on the button in some room no one can convince me we arent gluttons for our doom but i tried to make this place my place i asked for providence to smile upon me with his sweet face but ill tell you my place is of the sun and this place is of the dark i do not feel the romance i do not catch the spark my place is of the sun and this place is of the dark by grace my sight grows stronger and i will not be a pawn for the prince of darkness any longer maybe theres no haven in this world for tender age my heart beat like the wings of wild birds in a cage my greatest hope my greatest cause to grieve and my heart flew from its cage and it bled upon my sleeve the cries of passion were like wounds that needed healing i couldnt hear them for the thunder i was half the naked distance between hell and heavens ceiling and he almost pulled me under now someones on the telephone desperate in his pain someones on the bathroom floor doing her cocaine someones got his finger on the button in some room no one can convince me we arent gluttons for our doom i tried to make this place my place i asked for providence to smile upon me with his sweet face but ill tell you my place is of the sun and this place is of the dark i do not feel the romance i do not catch of spark my place is of the sun and this place is of the dark by grace my sight grows stronger grows stronger i do not feel the romance i do not catch the spark and i will not be a pawn for the prince of darkness any longer
Indigo Girls,blood and fire,"i have spent nights with matches and knives leaning over ledges only two flights up cutting my heart burning my soul nothing left to hold nothing left but blood and fire you have spent nights thinking of me missing my arms but you needed to leave leaving my cuts leaving my burns hoping id learn blood and fireare too much for these restless arms to hold and my nights of desire are calling me back to your fold and i am calling you calling you from 10,000 miles away wont you wet my fire with your love babe i am looking for someone who can take as much as i give give back as much as i need and still have the will to live i am intense i am in need i am in pain i am in love i feel forsaken like the things i gave away blood and fire are too much for these restless arms to hold and my nights of desire are calling me back to your fold and i am calling you calling you from 10,000 miles away wont you wet my fire with your love babe  i am intense i am in need i am in pain i am in love i am intense i am in need i am in pain i am in love i am intense i am in need i am in pain i am in love  blood and fire are too much for these restless arms to hold and my nights of desire are calling me back to your fold and i am calling you calling you from 10,000 miles away wont you wet my fire with your love babe "
Indigo Girls,tried to be true,from baby to best with no second test little storms destroy you  here is the fame they promised to give you taking the place of my hand now  did you try to be true what separates me from you what separates me from you now  did you borrow the soul the soul that you sell now what does your conscience tell you where are the demons of your desire why does my love destroy you  did you try to be true what separates me from you what separates me from you now  i said i tried to be true what separates me from you i said i tried tried to be true what separates me from you what separates me from you now  did you try to be true what separates me from you what separates me from you now  so where is the fame where is the fortune where is the world that denies you who is to blame when my heart finally forfeits to a road that will only misguide you  did you try to be true what separates me from you what separates me from you now  did we try to be true what separates me from you did we try try to be true what separates me from you did you try to be true what separates me from you what separates me from you now  i bought my love a hunger more precious than a stone all these fatal flowers did i misguide you where is the world that denies you try to be true did you try to be true what separates me from you what separates me from you now 
Indigo Girls,loves recovery,during the time of which i speak it was hard to turn the other cheek to the blows of insecurity feeding the cancer of my intellect the blood of love soon neglected lay dying in the strength of its impurity meanwhile our friends we thought were so together theyve all gone and left each other in search of fairer weather and we sit here in our storm and drink a toast to the slim chance of loves recovery there i am in younger days star gazing painting picture perfect maps of how my life and love would be not counting the unmarked paths of misdirection my compass faith in loves perfection i missed ten million miles of road i should have seen meanwhile our friends we thought were so together left each other one by one in search of fairer weather and we sit here in our storm and drink a toast to the slim chance of loves recovery rain soaked and voice choked like silent screaming in a dream i search for our absolute distinction not content to bow and bent to the whims of culture that swoop like vultures eating us away eating us away eating us away to our extinction oh how i wish i were a trinity so if i lost a part of me id still have two of the same to live but nobody gets a lifetime rehearsal as specks of dust were universal to let this love survive would be the greatest gift we could give tell all the friends who think theyre so together that these are ghosts and mirages these thoughts of fairer weather though its storming out i feel safe within the arms of loves discovery
Indigo Girls,lan of canaan,you can go to the east to find your inner hemisphere you say were under the same sky babe youre bound to realize honey its not that clear im not your promise land im not your promise one im not your land of canaan sweetheart waiting for you under the sun im lonely tonight im missing you now im wanting your love and youre giving it out im lonely tonight im lonely tonight im lonely tonight well the meanings changed for what its worth its just a senseless game i should think of love but its fear every time i hear your heart strain its not the fallen man its not the call of time its just the london skyline telling me youre not mine im lonely tonight im missing you now im wanting your love and youre giving it out im lonely tonight im lonely tonight im lonely tonight my blood is running dry my skin is my skin is growing thin for every time you find yourself you lose a little bit of me from within its just a raging cycle why cant we bring it all to the end of the line from inside this existence sweetheart time is not on my side im lonely tonight im missing you now im wanting your love and youre giving it out im lonely tonight im lonely tonight im lonely tonight im not your promised land im not your promised one im not your promised land im not your promised one im not your land of canaan sweetheart im not your land of canaan sweetheart im not your land of canaan sweetheart waiting for you under the sun im lonely tonight 
Indigo Girls,center stage,laughing in a crown of jewels numbness from a scepters wound toss and turn i spin and learn catch yourself before you burn a jokers dance before the king jangling beads a silver ring close your eyes and bare the sound jumping up falling down falling falling falling falling down look yourself in the eye before you drown royal rebels discover you trust you turn there is no truth and circle circle why are you scared why a smile instead of tears im gulping smoke to fade away figures floating down to lay meet the joker and the thief the king and queen but no relief falling falling falling falling down look yourself in the eye before you drown the king is in the counting house counting out his money {look yourself in the eye before you drown falling falling falling falling down } falling falling falling falling down look yourself in the eye before you drown the queen is in her parlour eating bread and honey {look yourself in the eye before you drown falling falling falling falling down } falling falling falling falling down look yourself in the eye before you drown mary had a little lamb i cross myself before i die the leaping man he asks me why well your rhythm is off i reply now you must dance the dance that you imply! your actions will follow you full circle round your actions will follow you full circle round your actions will follow you full circle round your actions will follow you full circle round the higher the leap i said the harder the ground! 
Indigo Girls,history of us,i went all the way to paris to forget your face captured in stained glass young lives long since passed statues of lovers every place i went all across the continent to relieve this restless love i walked through the ruins icons of glory smashed by the bombs from above so we must love while these moments are still called today take part in the pain of this passion play stretching our youth as we must until we are ashes to dust until time makes history of us jeu de paumes full of faces knowing peace knowing strife leisure and toil still its canvas and oil theres just no medium for life in the midst of the rubble i felt a sense of rebirth in a dusty cathedral the living god called and i prayed for my life here on earth so we must love while these moments are still called today take part in the pain of this passion play stretching our youth as we must until we are ashes to dust until time makes history of us there are mountains in switzerland brilliant cold as they stand from my hotel room watching the half moon bleeding its light like a lamb and the town is illumined its tiny figures are fast asleep and it dawns on me the time is upon me to return to the flock i must keep so we must love while these moments are still called today take part in the pain of this passion play stretching our youth as we must until we are ashes to dust until time makes history of us
Indigo Girls,three hits,three hits to the heart son and its poetry in motion one could send you down the river threes a strange way to be delivered would you trade your words for freedom thats a barter for a blind man three hits to the heart son and its poetry in motion are you leveed like a treasure only words can help me find you and this worlds a fickle measure i will painfully remind you from a wise man to your red hand you lay covered in our best sins three hits to the heart son and its poetry in motion well i dream you constant stranger with your best bloods and your anger you say mother do you claim me my beloved do you blame me well the first two might release you but the last one sings in me son three hits to the heart son and its poetry in motion three hits to the heart son and the last one sings in me
Indigo Girls,galileo,galileos head was on the block the crime was looking up the truth and as the bombshells of my daily fears explode i try to trace them to my youth and then you had to bring up reincarnation over a couple of beers the other night  an now im serving time for mistakes made by another in another lifetime how long til my soul gets it right can any human being ever reach that kind of light i call on the resting soul of galileo_ king of night vision king of insight an then i think about my fear of motion which i never could explain some other fool across the ocean years ago must have crashed his little airplane how long til my soul gets it right can any human being ever reach that kind of light i call on the resting soul of galileo king of night vision king of insight im not making a joke you know me i take everything so seriously if we wait for the time til all souls get it right then at least i know therell be no nuclear annihilation in my lifetime im still not right  i offer thanks to those before me thats all ive got to say cause maybe you squandered big bucks in your lifetime  now i have to pay! but then again it feels like some sort of inspiration to let the next life off the hook or shell say look what i had to overcome from my last life  i think ill write a book! how long till my soul gets it right my soul gets it right can any human being ever reach the highest light except for the resting soul of galileo galileo god bless your soul king of night vision king of insight how long til my soul gets it right how long til my soul gets it right how long til my soul gets it right
Indigo Girls,ghost,theres a letter on the desktop that i dug out of a drawer the last truce we ever came to from our adolescent war and i start to feel a fever from the warm air through the screen you come regular like seasons shadowing my dreams and the mississippis mighty but it starts in minnesota at a place where you could walk across with five steps down and i guess thats how you started like a pinprick to my heart but at this point you rush right through me and i start to drown and theres not enough room in this world for my pain signals cross and love gets lost and time passed makes it plain of all my demon spirits i need you the most im in love with your ghost im in love with your ghost dark and dangerous like a secret that gets whispered in a hush dont tell a soul when i wake the things i dreamt about you last night make me blush dont tell a soul when you kiss me like a lover then you sting me like a viper i go follow to the river play your memory like the piper and i feel it like a sickness how this love is killing me but id walk into the fingers of your fire willingly and dance the edge of sanity ive never been this close in love with your ghost ooooh: unknowing captor youll never know how much you pierce my spirit but i cant touch you can you hear it a cry to be free or im forever under lock and key as you pass through me now i see your face before me i would launch a thousand ships to bring your heart back to my island as the sand beneath me slips as i burn up in your presence and i know now how it feels to be weakened like achilles with you always at my heels and my bitter pill to swallow is the silence that i keep that poisons me i cant swim free the river is too deep though im baptized by your touch i am no worse at most in love with your ghost
Indigo Girls,joking,you said the world was magic i was wide eyed and laughing we were dancing up to the bright side forget about your ego forget about your pride and you will never have to compromise but you were only joking we talked about our mothers kissed the wounds of our fathers i couldve been your sister i wouldve been your brother you kissed me like i was a soldier heading for war im a dying man but i dont know what for but you were only joking you were only joking brother gravel and glass on the bottom of my feet i bruised my heels on the swollen street we were girls in bars we were boys on the town bumping like a pinball off a careless crowd you said good friends are hard to come by i laughed and bought you a beer cause its too corny to cry well sentiment given and sentiment lost you shook it off with a smirk and a toss and you were only joking you were only joking brother
Indigo Girls,jonas and ezekial,i left my anger in a river running highway five new hampshire vermont border by college farms hubcaps and falling rocks voices in the woods and the mountaintops i used to search for reservations and native lands before i realized everywhere stand there have been tribal feet running wild as fire some past life sister of my desire jonas and ezekial hear me now steady now dont come out im not ready for the dead to show its face whose turn is it anyway when i was young my people taught me well give back what you take or youll go to hell its not the devils land you know its not that kind every devil i meet becomes a friend of mine every devil i meet is an angel in disguise jonas and ezekial hear me now steady now dont come out im not ready for the dead to show its face whose turn is it anyway white chain rope fear be still my dear a bullet in the head now hes dead a friend of a friend someone said he was an activist with a very short life i think theres a lesson here he died without a fight in the war over land where the world began prophecy says its where the world will end but theres a tremor growing in our own backyard fear in our heads fear in our hearts prophets in the graveyard jonas and ezekiel hear me now stead now dont come out im not ready for the dead to show its face whose turn is it anyway jonas and ezekial hear me now steady now i feel your ghost about im not ready for the dead to show its face whose angel are you anyway 
Indigo Girls,love will come to you,guess i wasnt the best one to ask me myself with my face pressed up against loves glass to see the shiny toy ive been hoping for the one i never can afford the wide world spins and spits turmoil and the nations toil for peace but the paws of fear upon your chest only love can soothe that beast and my words are paper tigers no match for the predator of pain inside her i say love will come to you hoping just because i spoke the words that theyre true as if ive offered up a crystal ball to look through where theres now one there will be two i was born under the sign of cancer like brushing cloth i smooth the wrinkles for an answer i close my eyes and wish you fine im always closing my eyes wishing im fine even though i know youre not this time even though im not this time i say love will come to you hoping just because i spoke the words that theyre true as if ive offered up a crystal ball to look through where theres now one there will be two dodging your memories a field of knives always on the outside looking in on others lives i say love will come to you hoping just because i spoke the words that theyre true as if ive offered up a crystal ball to look through where theres now one there will be two and i wish her insight to battle loves blindness strength from the milk of human kindness a safe place for all the pieces that scattered learn to pretend theres more than love that matters
Indigo Girls,romeo and juliet,love struck romeo sings the streets a serenade hes layin everybody low hes got a love song that he made well he finds a convenient street light and he steps out of the shade and says something like you and me babe how about it juliet says hey its romeo you nearly gave me a heart attack yeah well hes underneath my window now shes singin hey la my boyfriends back you shouldnt come around here singin up to people like that oh anyway what you gonna do about it oh juliet the dice were loaded from the start and i bet and you exploded into my heart and i forget i forget the movie song when you gonna realize it was just that the time was wrong julie we both come up on different streets and they were both streets of shame theyre both dirty both mean and yes even our dreams were the same but i dreamed your dream for you and now your dream is real so tell me honey now how can you look at me as if i were just another one of your deals now you can fall for chains of silver and you can fall for chains of gold you know you you fall for pretty strangers and the promises since they hold well you promised me everything and then you and then you promised me thick and thin and now you just turn away and say romeo i think i used to have a scene with him oh juliet when we made love you used to cry you said i love you like the stars above im gonna love you till i die theres a place for us i know you know this song now when you gonna realize it was just that the time was wrong julie im so in love so in love yeah but i cant do the talk like they talk on my tv screen i cant do a love song not the way you sung it to me i cant do anything but i would do anything for you oh no i cant do anything except be in love with you yeah now all i do is miss you and the way it used to be and all and all i do is keep the beat i keep bad bad company and all i do is kiss you through the bars of this rhyme when julie id do the stars with you anytime oh juliet when we made love you used to cry you said i love you like the stars above im gonna love you till i die theres a place for us i know you know the movie song one day you gonna realize it was just that the time was wrong julie julie julie oh this love struck romeo sings the streets a serenade layin everybody low hes got a love song that he made finds a convenient street light and hell step out of the shade and hell say something like you and me babe how about it 
