artist,song title ,text
Indigo Girls,virginia wolf,some will strut and some will fret see this an hour on the stage others will not but theyll sweat in their hopelessness in the rage were all the same the men of anger and the women of the page they published your diary and thats how i got to know you key to the room of your own and a mind without end heres a young girl on a kind of a telephone line through time the voice at the other end comes like a long lost friend so i know im alright my life will come my life will go still i feel its alright i just got a letter to my soul when my whole life is on the tip of my tongue empty pages for the no longer young the apathy of time laughs in my face you say each life has its place the hatches were battened thunderclouds rolled and the critics stormed battles surrounded the white flag of your youth but if you need to know that you weathered the storm of cruel mortality a hundred years later im sitting here living proof so you know its alright your life will come your life will go still youll feel its alright someone will get a letter to your soul when your whole life was on the tip of you tongue empty pages for the no longer young the apathy of time laughed in your face did you hear me say each life has its place the place where you hold me is dark in a pocket of truth the moon has swallowed the sun and the light of the earth and so it was for you when the river eclipsed your life but sent your soul like a message in a bottle to me and it was my rebirth so we know its alright life will come and life will go still we know its alright someone will get a message to your soul then you know its alright and you feel its alright when my whole life is on the tip of my tongue empty pages for the no longer young then you know its alright and you feel its alright each life has its place you say each life has its place its alright
Indigo Girls,chickenman,i am an only child born of the wild riddled to spend my time defending my land you are my only one born in the sun riddled to spend your time defending my plan dead dog on the highway median cats are growling at me i turn my lights on brighter counting through the night ride one more life for the taker chickenman one more song for the maker chickenman on the road to athens i saw a dead deer on the highway i slipped into a desert five prairie dogs and a rabbit i was running down on queen street i saw a woman on the sidewalk she was beaten by a stranger danger danger danger one more life for the taker chickenman chicken man chickenman hold my hand one more life forthe maker hold my hand chickenman i was on the road to austin i met a man on the highway he sold me junk and conversation he was wise and dirty from the wather i said darkness into darkness all the carnage of my journeys makes it hard to be living he said its a long road to be forgiven one more life for the taker chickenman chickenman chickenman hold my hand one more song for the maker chickenman chickenman chickenman hold my hand i am an only child born of the wild riddled to spend my time defending my land you are my only one born in the sun riddled to spend you time defending my plan i went looking for a car found myself beneath the stars i went looking for a girl found a man and his world chickenman chickenman chickenman hold my hand i am an only child hold my hand chickenman chickenman chickenman hold my hand
Indigo Girls,airplane,up on the airplane nearer my god to thee i start making a deal inspired by gravity if i did wrong i wont do it again i can be sweet and good and nice and if i had enemies theyre friends i hold onto my life with the grip of a vice up on the airplane nearer my god to thee i start making a deal inspired by gravity that little spot on the ground is my hometown i like to call it my home and its sweet id rather take a seat down there than a throne up here up above 30 000 feet and im up on the airplane i never shouldve read my horo scope or the fortune on the bubble gum strip saying what you think wont happen will great thing to read before a trip on an airplane pilot says the big blue skys like a swimming pool big fluffy clouds like a feather bed id rather have a real pillow underneath my head lying in my bed which is in my hometown which is on the ground far from an airplane far from an airplane up on the airplane up on the ill be making a deal up on the ill be making a deal up on the ill be making a deal
Indigo Girls,nashville,as i drive from your pearly gates i realize that i just cant stay all those mountains they kept you locked inside and hid the truth from my slighted eyes i came to you with a half open heart dreams upon my back illusions of a brand new start nashville cant i carry the load is it my fault i cant reap what i sow nashville did you give me half a chance with your southern style and your hidden dance all those voices they whisper through my walls they talk of falling fast they say im losing it all they say im running blind to a love of my own but ill be walking proud im saving what i still own i fell on my knees to kiss your land but you are so far down i cant even see to stand nashville you forgot the human race you see with half a mind what colors hide the face nashville id like to know your fate id like to stay awhile but ive seen your lowered state today im leaving but ive got all these debts to pay we all owe our dues ill pay in some other place i never ask that you pay me back we all arrive with more i left with less than i had your town is made for people passing through a last chance for cause well i thought i knew nashville tell me what you gonna do with your southern style itll never pull you through nashville i cant place no blame but if you forget my face ill never call your name again i fell on my knees to kiss your land but you are so far down i cant even see to stand nashville you forgot the human race you see with half a mind what colors hide the face nashville id like to know your fate id like to stay awhile but ive seen your lowered state today im running away
Indigo Girls,let it be me,sticks and stones battle zones a single light bulb on a single thread for the black sirens wail history fails rose colored glass begins to age and crack while the politicians shadowbox the power ring in an endless split decision never solve anything from a neighbors distant land i heard the strain of the common man let it be me this is not a fighting song let it be me not a wrong for a wrong let it be me if the world is night shine my life like a light well the world seems spent and the president has no good idea of who the masses are well im one of them and im among friends trying to see beyond the fences of our own backyard ive seen kingdoms blow like ashes in the winds of change but the power of truth is the fuel for the flame so the darker the ages get theres a stronger beacon yet let it be me this is not a fighting song let it be me not a wrong for a wrong let it be me if the world is night shine my life like a light in the kind word you speak in the turn of the cheek when your vision stays clear in the face of your fear then you see turning off a light switch is their only power when we stand like spotlights in a mighty tower all for one and one for all then we sing the common call let it be me this is not a fighting song let it be me not a wrong for a wrong let it be me if the world is night shine my life like a light
Indigo Girls,cedar tree,you dug a well you dug it deep for every wife you buried you planted a cedar tree the best you ever had i stand where you stood i stand for the bad or good i am green you are wood the best he ever had i dig a well i dig it deep and for my only love i plant a cedar tree the best we ever had